{
  "schema_version": 1,
  "episode": "ep07-737-max",
  "generated_at": "2026-05-28T21:27:15Z",
  "artifacts": [
    {
      "id": "ep07-737-max:final:Ep7_737-MAX.wav",
      "kind": "audio_master",
      "status": "final_artifact",
      "repo_path": null,
      "artifact_path": ".artifacts/season-01/ep07-737-max/final/Ep7_737-MAX.wav",
      "original_path": "/Users/mike/Episodes_CascadeEffects/Ep7_737-MAX/final/Ep7_737-MAX.wav",
      "sha256": "adaf19d653f7d673d601ba0f273ef822dbce375dee25ec5c3554f687b839db71",
      "bytes": 83161166,
      "created_at": "2026-05-28T21:27:15Z",
      "source_stage": "episode_final_dir",
      "episode": "ep07-737-max",
      "source_manifest": null
    },
    {
      "id": "ep07-737-max:longform-publish-ready:737-max_living_cover_final_review_1080p24.mp4",
      "kind": "longform_review_mp4",
      "status": "keep_artifact",
      "repo_path": null,
      "artifact_path": ".artifacts/season-01/ep07-737-max/longform-publish-ready/737-max_living_cover_final_review_1080p24.mp4",
      "original_path": "/Users/mike/Episodes_CascadeEffects/Ep7_737-MAX/production/long_form_video_v1/youtube/publish_readiness/737-max_publish_readiness_20260526T080000Z/media/737-max_living_cover_final_review_1080p24.mp4",
      "sha256": "d2fb1f036f149f9a84638431f094826994b6b58e621645d16a75638695301dd8",
      "bytes": 277547369,
      "created_at": "2026-05-28T21:27:15Z",
      "source_stage": "publish_readiness",
      "episode": "ep07-737-max",
      "source_manifest": "/Users/mike/Episodes_CascadeEffects/Ep7_737-MAX/production/long_form_video_v1/youtube/publish_readiness/737-max_publish_readiness_20260526T080000Z/publish_readiness_manifest.json"
    },
    {
      "id": "ep07-737-max:shorts-publish-ready:737max_theme_intro_captioned_youtube_short.mp4",
      "kind": "shorts_captioned_final_mp4",
      "status": "keep_artifact",
      "repo_path": null,
      "artifact_path": ".artifacts/season-01/ep07-737-max/shorts-publish-ready/737max_theme_intro_captioned_youtube_short.mp4",
      "original_path": "/Users/mike/Episodes_CascadeEffects/Shorts_Publish_Readiness/737max_publish_ready_20260521T084500Z/737max_theme_intro_captioned_youtube_short.mp4",
      "sha256": "4fc24d28b265aefcf5e6a694dabef71efd50da779e88007195e3d11c17056d03",
      "bytes": 47526273,
      "created_at": "2026-05-28T21:27:15Z",
      "source_stage": "shorts_publish_readiness",
      "episode": "ep07-737-max",
      "source_manifest": "/Users/mike/Episodes_CascadeEffects/Shorts_Publish_Readiness/737max_publish_ready_latest/publish_ready_package_manifest.json"
    }
  ]
}
