{
  "schema_version": 1,
  "episode": "ep04-semmelweis",
  "generated_at": "2026-05-28T21:27:15Z",
  "artifacts": [
    {
      "id": "ep04-semmelweis:final:Ep4_Semmelweis.wav",
      "kind": "audio_master",
      "status": "final_artifact",
      "repo_path": null,
      "artifact_path": ".artifacts/season-01/ep04-semmelweis/final/Ep4_Semmelweis.wav",
      "original_path": "/Users/mike/Episodes_CascadeEffects/Ep4_Semmelweis/final/Ep4_Semmelweis.wav",
      "sha256": "bf7562029466226f6bf33d64829ea41712220e63e4c5f37918cff53ec0fa1ebf",
      "bytes": 75042894,
      "created_at": "2026-05-28T21:27:15Z",
      "source_stage": "episode_final_dir",
      "episode": "ep04-semmelweis",
      "source_manifest": null
    },
    {
      "id": "ep04-semmelweis:longform-publish-ready:semmelweis_living_cover_final_review_1080p24.mp4",
      "kind": "longform_review_mp4",
      "status": "keep_artifact",
      "repo_path": null,
      "artifact_path": ".artifacts/season-01/ep04-semmelweis/longform-publish-ready/semmelweis_living_cover_final_review_1080p24.mp4",
      "original_path": "/Users/mike/Episodes_CascadeEffects/Ep4_Semmelweis/production/long_form_video_v1/youtube/publish_readiness/semmelweis_publish_readiness_20260526T203119Z/media/semmelweis_living_cover_final_review_1080p24.mp4",
      "sha256": "7a738406f9bdeab1b65ca3c7eb5cf29cf523e1fc81d475f21cfc5be92c3fbc48",
      "bytes": 233449993,
      "created_at": "2026-05-28T21:27:15Z",
      "source_stage": "publish_readiness",
      "episode": "ep04-semmelweis",
      "source_manifest": "/Users/mike/Episodes_CascadeEffects/Ep4_Semmelweis/production/long_form_video_v1/youtube/publish_readiness/semmelweis_publish_readiness_20260526T203119Z/publish_readiness_manifest.json"
    },
    {
      "id": "ep04-semmelweis:shorts-publish-ready:semmelweis_theme_intro_captioned_youtube_short.mp4",
      "kind": "shorts_captioned_final_mp4",
      "status": "keep_artifact",
      "repo_path": null,
      "artifact_path": ".artifacts/season-01/ep04-semmelweis/shorts-publish-ready/semmelweis_theme_intro_captioned_youtube_short.mp4",
      "original_path": "/Users/mike/Episodes_CascadeEffects/Shorts_Publish_Readiness/semmelweis_publish_ready_20260521T084500Z/semmelweis_theme_intro_captioned_youtube_short.mp4",
      "sha256": "a271607981c1d1c1586c384f1137c585dad63dbe271bcee4dc3607afe021b4ea",
      "bytes": 50257652,
      "created_at": "2026-05-28T21:27:15Z",
      "source_stage": "shorts_publish_readiness",
      "episode": "ep04-semmelweis",
      "source_manifest": "/Users/mike/Episodes_CascadeEffects/Shorts_Publish_Readiness/semmelweis_publish_ready_latest/publish_ready_package_manifest.json"
    }
  ]
}
